[
    {
      "dataField": "schools.CDSCode",
      "headerText": "CDS Code",
      "uniqueIdentifier": "schools.CDSCode",
      "format": "string",
      "filterOptions": {
        "filterOperation": "InList",
        "filterComboBoxBuildFromGrid": true
      },
      "lockMode": "none"
    },
    {
      "dataField": "schools.School",
      "headerText": "School Name",
      "uniqueIdentifier": "schools.School",
      "format": "string",
      "filterOptions": {
        "filterWaterMark": "Contains",
        "filterOperation": "Contains"
      },
      "lockMode": "left"
    },
    {
      "dataField": "schools.District",
      "headerText": "District Name",
      "uniqueIdentifier": "schools.District",
      "format": "string",
      "filterOptions": {
        "filterWaterMark": "*search*",
        "filterOperation": "Wildcard"
      },
      "lockMode": "left"
    },
    {
      "dataField": "schools.NCESDist",
      "headerText": "NCES District",
      "uniqueIdentifier": "schools.NCESDist",
      "format": "string",
      "filterOptions": {
        "filterWaterMark": "Begins With",
        "filterOperation": "BeginsWith"
      },
      "lockMode": "none"
    },
    {
      "dataField": "schools.NCESSchool",
      "headerText": "NCES School",
      "uniqueIdentifier": "schools.NCESSchool",
      "format": "string",
      "filterOptions": {
        "filterWaterMark": "Begins With",
        "filterOperation": "BeginsWith"
      }
    },
    {
      "dataField": "schools.StatusType",
      "headerText": "Status",
      "uniqueIdentifier": "schools.StatusType",
      "format": "string",
      "filterOptions": {
        "filterOperation": "InList",
        "filterComboBoxBuildFromGrid": true
      }
    },
    {
      "dataField": "schools.County",
      "headerText": "County",
      "uniqueIdentifier": "schools.County",
      "format": "string",
      "filterOptions": {
        "filterOperation": "InList",
        "filterComboBoxBuildFromGrid": true
      }
    },
    {
      "dataField": "schools.Street",
      "headerText": "Street",
      "uniqueIdentifier": "schools.Street",
      "format": "string",
      "filterOptions": {
        "filterWaterMark": "Begins With",
        "filterOperation": "BeginsWith"
      },
      "hidden": false,
      "children": [
        {
          "dataField": "schools.StreetAbr",
          "headerText": "Street Abr",
          "uniqueIdentifier": "schools.StreetAbr",
          "format": "string",
          "filterOptions": {
            "filterWaterMark": "Begins With",
            "filterOperation": "BeginsWith"
          },
          "hidden": true
        },
        {
          "dataField": "schools.City",
          "headerText": "City",
          "uniqueIdentifier": "schools.City",
          "format": "string",
          "filterOptions": {
            "filterOperation": "InList",
            "filterComboBoxBuildFromGrid": true
          },
          "hidden": true
        },
        {
          "dataField": "schools.State",
          "headerText": "State",
          "uniqueIdentifier": "schools.State",
          "format": "string",
          "filterOptions": {
            "filterWaterMark": "Begins With",
            "filterOperation": "BeginsWith"
          },
          "hidden": true
        },
        {
          "dataField": "schools.Zip",
          "headerText": "Zip",
          "uniqueIdentifier": "schools.Zip",
          "format": "string",
          "filterOptions": {
            "filterWaterMark": "Begins With",
            "filterOperation": "BeginsWith"
          },
          "hidden": true
        }
      ]
    },
    {
      "dataField": "schools.MailStreet",
      "headerText": "Mail Street",
      "uniqueIdentifier": "schools.MailStreet",
      "format": "string",
      "filterOptions": {
        "filterWaterMark": "Begins With",
        "filterOperation": "BeginsWith"
      },
      "hidden": false,
      "children": [
        {
          "dataField": "schools.MailStrAbr",
          "headerText": "Mail Str Abr",
          "uniqueIdentifier": "schools.MailStrAbr",
          "format": "string",
          "filterOptions": {
            "filterWaterMark": "Begins With",
            "filterOperation": "BeginsWith"
          },
          "hidden": true
        },
        {
          "dataField": "schools.MailCity",
          "headerText": "Mail City",
          "uniqueIdentifier": "schools.MailCity",
          "format": "string",
          "filterOptions": {
            "filterWaterMark": "Begins With",
            "filterOperation": "BeginsWith"
          },
          "hidden": true
        },
        {
          "dataField": "schools.MailState",
          "headerText": "Mail State",
          "uniqueIdentifier": "schools.MailState",
          "format": "string",
          "filterOptions": {
            "filterWaterMark": "Begins With",
            "filterOperation": "BeginsWith"
          },
          "hidden": true
        },
        {
          "dataField": "schools.MailZip",
          "headerText": "Mail Zip",
          "uniqueIdentifier": "schools.MailZip",
          "format": "string",
          "filterOptions": {
            "filterWaterMark": "Begins With",
            "filterOperation": "BeginsWith"
          },
          "hidden": true
        }
      ]
    },
    {
      "dataField": "schools.Phone",
      "headerText": "Phone",
      "uniqueIdentifier": "schools.Phone",
      "format": "string",
      "filterOptions": {
        "filterWaterMark": "Begins With",
        "filterOperation": "BeginsWith"
      },
      "hidden": true
    },
    {
      "dataField": "schools.Ext",
      "headerText": "Ext",
      "uniqueIdentifier": "schools.Ext",
      "format": "string",
      "filterOptions": {
        "filterWaterMark": "Begins With",
        "filterOperation": "BeginsWith"
      },
      "hidden": true
    },
    {
      "dataField": "schools.Website",
      "headerText": "Website",
      "uniqueIdentifier": "schools.Website",
      "format": "string",
      "filterOptions": {
        "filterWaterMark": "Begins With",
        "filterOperation": "BeginsWith"
      },
      "hidden": true
    },
    {
      "dataField": "schools.OpenDate",
      "headerText": "Open Date",
      "uniqueIdentifier": "schools.OpenDate",
      "format": "date",
      "textAlign": "right",
      "filterOptions": {
        "filterOperation": "Between"
      },
      "hidden": true
    },
    {
      "dataField": "schools.ClosedDate",
      "headerText": "Closed Date",
      "uniqueIdentifier": "schools.ClosedDate",
      "format": "date",
      "textAlign": "right",
      "filterOptions": {
        "filterOperation": "Between"
      },
      "hidden": true
    },
    {
      "dataField": "schools.Charter",
      "headerText": "Charter",
      "uniqueIdentifier": "schools.Charter",
      "format": "boolean",
      "textAlign": "center",
      "filterOptions": {
        "filterOperation": "Equals",
        "filterComparisonType": "Boolean"
      },
      "hidden": true
    },
    {
      "dataField": "schools.CharterNum",
      "headerText": "Charter Num",
      "uniqueIdentifier": "schools.CharterNum",
      "format": "string",
      "filterOptions": {
        "filterWaterMark": "Begins With",
        "filterOperation": "BeginsWith"
      },
      "hidden": true
    },
    {
      "dataField": "schools.FundingType",
      "headerText": "Funding Type",
      "uniqueIdentifier": "schools.FundingType",
      "format": "string",
      "filterOptions": {
        "filterOperation": "InList",
        "filterComboBoxBuildFromGrid": true
      }
    },
    {
      "dataField": "schools.DOC",
      "headerText": "DOC",
      "uniqueIdentifier": "schools.DOC",
      "format": "string",
      "filterOptions": {
        "filterWaterMark": "Begins With",
        "filterOperation": "BeginsWith"
      },
      "hidden": true
    },
    {
      "dataField": "schools.DOCType",
      "headerText": "DOC Type",
      "uniqueIdentifier": "schools.DOCType",
      "format": "string",
      "filterOptions": {
        "filterOperation": "InList",
        "filterComboBoxBuildFromGrid": true
      }
    },
    {
      "dataField": "schools.SOC",
      "headerText": "SOC",
      "uniqueIdentifier": "schools.SOC",
      "format": "string",
      "filterOptions": {
        "filterWaterMark": "Begins With",
        "filterOperation": "BeginsWith"
      },
      "hidden": true
    },
    {
      "dataField": "schools.SOCType",
      "headerText": "SOC Type",
      "uniqueIdentifier": "schools.SOCType",
      "format": "string",
      "filterOptions": {
        "filterOperation": "InList",
        "filterComboBoxBuildFromGrid": true
      }
    },
    {
      "dataField": "schools.EdOpsCode",
      "headerText": "Ed Ops Code",
      "uniqueIdentifier": "schools.EdOpsCode",
      "format": "string",
      "filterOptions": {
        "filterWaterMark": "Begins With",
        "filterOperation": "BeginsWith"
      },
      "hidden": true
    },
    {
      "dataField": "schools.EdOpsName",
      "headerText": "Ed Ops Name",
      "uniqueIdentifier": "schools.EdOpsName",
      "format": "string",
      "filterOptions": {
        "filterOperation": "InList",
        "filterComboBoxBuildFromGrid": true
      },
      "hidden": true
    },
    {
      "dataField": "schools.EILCode",
      "headerText": "EIL Code",
      "uniqueIdentifier": "schools.EILCode",
      "format": "string",
      "filterOptions": {
        "filterWaterMark": "Begins With",
        "filterOperation": "BeginsWith"
      },
      "hidden": true
    },
    {
      "dataField": "schools.EILName",
      "headerText": "EIL Name",
      "uniqueIdentifier": "schools.EILName",
      "format": "string",
      "filterOptions": {
        "filterOperation": "InList",
        "filterComboBoxBuildFromGrid": true
      }
    },
    {
      "dataField": "schools.GSoffered",
      "headerText": "G Soffered",
      "uniqueIdentifier": "schools.GSoffered",